{
  "plan_version": "1.0.0",
  "generated_at": "2026-07-13T12:30:47.894614Z",
  "mode": "final_write_plan_draft",
  "ready_for_write_to_main_pipeline": false,
  "summary": {
    "input_candidate_count": 3,
    "input_simulation_count": 3,
    "input_match_count": 3,
    "input_resolution_count": 0,
    "plan_insert_count": 3,
    "plan_update_count": 0,
    "plan_skip_count": 0,
    "plan_blocked_count": 0,
    "high_risk_count": 0,
    "medium_risk_count": 0,
    "low_risk_count": 3,
    "ready_for_execution": false,
    "ready_for_write_to_main_pipeline": false,
    "proposed_status": "FINAL_WRITE_PLAN_READY_FOR_HUMAN_REVIEW"
  },
  "plan_items": [
    {
      "final_plan_item_id": "PLAN_ITEM_0001",
      "write_candidate_id": "WRITE_CANDIDATE_0001",
      "simulation_record_id": "SIM_REC_0001",
      "match_result_id": "MATCH_RES_0001",
      "resolution_item_id": null,
      "supplier_code": "CHINT",
      "material_code": "NXM-63S",
      "description": "MCCB Chint NXM-63S 3P 25÷63 25",
      "unit": "cái",
      "quantity": 1.0,
      "unit_price": 800000,
      "amount": 800000.0,
      "currency": "VND",
      "write_key": "CHINT|NXM-63S|P3|800000|MCCBCHINTNXM63S3P256325",
      "final_planned_action": "PLAN_INSERT",
      "action_source": "master_match",
      "matched_master_record_id": null,
      "resolution_decision": null,
      "risk_level": "LOW",
      "risk_reasons": [],
      "provenance": "Source PDF: Bảng giá Chint 1-3-2023 ck 50.pdf, Page: 3, Layout: chint_mccb_nxm_nm1, Method: coordinate_column_profiler",
      "evidence_text": "25÷63 25 NXM-63S 800,000",
      "ready_for_execution": false
    },
    {
      "final_plan_item_id": "PLAN_ITEM_0002",
      "write_candidate_id": "WRITE_CANDIDATE_0002",
      "simulation_record_id": "SIM_REC_0002",
      "match_result_id": "MATCH_RES_0002",
      "resolution_item_id": null,
      "supplier_code": "CHINT",
      "material_code": "NXM-125S",
      "description": "MCCB Chint NXM-125S 3P 80÷125 25",
      "unit": "cái",
      "quantity": 1.0,
      "unit_price": 860000,
      "amount": 860000.0,
      "currency": "VND",
      "write_key": "CHINT|NXM-125S|P3|860000|MCCBCHINTNXM125S3P801252",
      "final_planned_action": "PLAN_INSERT",
      "action_source": "master_match",
      "matched_master_record_id": null,
      "resolution_decision": null,
      "risk_level": "LOW",
      "risk_reasons": [],
      "provenance": "Source PDF: Bảng giá Chint 1-3-2023 ck 50.pdf, Page: 3, Layout: chint_mccb_nxm_nm1, Method: coordinate_column_profiler",
      "evidence_text": "80 ÷ 125 25 NXM-125S 860,000",
      "ready_for_execution": false
    },
    {
      "final_plan_item_id": "PLAN_ITEM_0003",
      "write_candidate_id": "WRITE_CANDIDATE_0003",
      "simulation_record_id": "SIM_REC_0003",
      "match_result_id": "MATCH_RES_0003",
      "resolution_item_id": null,
      "supplier_code": "CHINT",
      "material_code": "NXM-250S",
      "description": "MCCB Chint NXM-250S 3P 160,200,250 35",
      "unit": "cái",
      "quantity": 1.0,
      "unit_price": 1400000,
      "amount": 1400000.0,
      "currency": "VND",
      "write_key": "CHINT|NXM-250S|P3|1400000|MCCBCHINTNXM250S3P160200",
      "final_planned_action": "PLAN_INSERT",
      "action_source": "master_match",
      "matched_master_record_id": null,
      "resolution_decision": null,
      "risk_level": "LOW",
      "risk_reasons": [],
      "provenance": "Source PDF: Bảng giá Chint 1-3-2023 ck 50.pdf, Page: 3, Layout: chint_mccb_nxm_nm1, Method: coordinate_column_profiler",
      "evidence_text": "160,200,250 35 NXM-250S 1,400,000",
      "ready_for_execution": false
    }
  ]
}
